[
  {
    "asset_id": "coming-soon-hero",
    "version": "1.2.0",
    "kind": "section",
    "source": "human",
    "status": "approved",
    "component_key": "ComingSoonHero",
    "supported_directions": ["ltr", "rtl"],
    "props_schema": {
      "type": "object",
      "required": ["heading", "description"],
      "properties": {
        "heading": {"type": "string"},
        "description": {"type": "string"},
        "image_url": {"type": "string", "pattern": "^(https?://|/(?!/))\\S+$"},
        "image_alt": {"type": "string"},
        "document_url": {"type": "string", "pattern": "^(https?://|/(?!/))\\S+$"},
        "document_label": {"type": "string"}
      },
      "additionalProperties": false
    }
  }
]
